[
  {
    "schema_version": "gate-decision-v1",
    "asset_id": "skl-oBaDO5CceKnr",
    "asset_type": "skill",
    "asset_name": "eval-bridge-endpoint-b",
    "decided_at": "2026-09-06T18:37:25Z",
    "decision": "pending",
    "reasons": [
      "cold start: no usage evidence for this asset yet (nothing at fetched or beyond); pending by default",
      "no corrected record, so reject did not trigger",
      "author usr-n68ea5ythq has 1 asset(s) judged wrong within 30 days (skl-sZFb3KatWY6m); review priority: high"
    ],
    "evidence_refs": [],
    "signals": {
      "online": {
        "fetched": 0,
        "used_hard": 0,
        "used_soft": 0,
        "validated": 0,
        "corrected": 0,
        "distinct_actors": 0,
        "distinct_tasks": 0,
        "cross_user_validated": 0
      },
      "author": {
        "user_id": "usr-n68ea5ythq",
        "agent_id": "agt-5e4hna56j9",
        "confidence": 0.417,
        "computable": true,
        "distinct_tasks": 0
      },
      "offline": {
        "retrieval_rank_mean": null,
        "has_concrete_values": true,
        "duplicate_of": null
      }
    },
    "is_decoy": false,
    "expected_decision": null
  },
  {
    "schema_version": "gate-decision-v1",
    "asset_id": "skl-sZFb3KatWY6m",
    "asset_type": "skill",
    "asset_name": "eval-bridge-endpoint-a",
    "decided_at": "2026-09-06T18:37:25Z",
    "decision": "reject",
    "reasons": [
      "rule reject: a corrected record exists (reason=wrong, 1 record(s)) — the call it fed dialled 10.244.7.19:8096 — the asset's own value (10.244.7.19) — and timed out; the content explains the failure (timed out)",
      "reported signals: task ids not recorded on the events, so generalisation is not measurable here, 1 distinct consumer(s); neither is a threshold at this stage",
      "author confidence 0.417 (0 validated, 1 corrected, prior 0.5: neutral 0.5: no other author has cross-person outcomes)"
    ],
    "evidence_refs": [
      {
        "event_id": "evt-3efb63237b98",
        "state": "corrected",
        "relation": "cross_user"
      },
      {
        "event_id": "evt-b5cb47b6678a",
        "state": "used",
        "relation": "cross_user"
      }
    ],
    "signals": {
      "online": {
        "fetched": 1,
        "used_hard": 1,
        "used_soft": 0,
        "validated": 0,
        "corrected": 1,
        "distinct_actors": 1,
        "distinct_tasks": 0,
        "cross_user_validated": 0
      },
      "author": {
        "user_id": "usr-n68ea5ythq",
        "agent_id": "agt-5e4hna56j9",
        "confidence": 0.417,
        "computable": true,
        "distinct_tasks": 0
      },
      "offline": {
        "retrieval_rank_mean": null,
        "has_concrete_values": true,
        "duplicate_of": null
      }
    },
    "is_decoy": false,
    "expected_decision": null
  }
]
